id,title,status,loc.0,date,time,mins,desc,tags.0,tags.1,tags.2,people.0.id,people.0.name,people.1.id,people.1.name,people.2.id,people.2.name,people.3.id,people.3.name,people.4.id,people.4.name,140
2,Klingon science through the lens of language,,tlhIngan rlvSo' (Intl Boardroom),2017-11-24,14:00,60,"We can explore Klingon science and technology (as seen on TV!) by looking at the language that describes it. We will use the vocabulary of John Ford's Klingonaase (""The Final Reflection"") and Marc Okrand's tlhIngan Hol as a guide. We will compare and contrast it with other fictional Star Trek technologies, and with present-day reality.",Discussion,Klingon,STEM,1,Alan Anderson,,,,,,,,,
13,"Plus Size Cosplay - No Limits, No Restrictions",,Guinan's Place (Brickyard),2017-11-24,14:00,60,"I'll be going over some of the common misconceptions about ""appropriate"" body types to cosplay. I'll be touching on the intersectionality of the body positive movement and cosplay. I'll also be highlighting some of the major plus size cosplayers out there. There will be a brief Q&A at the end",Cosplay,,,30,Keeley Shoup,,,,,,,,,
3,Videos,,United Federation for Science (GB-6),2017-11-24,14:00,180,Science videos for all ages!,Presentation,,,59,March For Science Indianapolis,,,,,,,,,
1,The KAG Podcast: What the baQa' are we trying to do?,,tlhIngan rlvSo' (Intl Boardroom),2017-11-24,14:00,300,"General discussion of the KAG podcast. What we have done, what we plan to do and what do you want us to talk about?",Podcast,Klingon,,25,John Lars Shoberg,,,,,,,,,
5,Getting Started in Cosplay,,Briefing Room (DR-2),2017-11-24,15:00,60,Want to jump in to the world of cosplay? Learn from a professional how to get started!,Cosplay,,,37,Michelle Allen,,,,,,,,,
6,Honorable Klingon Episodes and Moments,,tlhIngan rlvSo' (Intl Boardroom),2017-11-24,15:00,60,"Klingon fans breakdown their favorite Klingon episodes, Klingon characters, and Klingon show moments!",Discussion,Klingon,,23,Jen Usellis,,,,,,,,,
113,Happy Unbirthday Tea Party,,Observation Lounge (Golden Preconvene),2017-11-24,15:00,120,"It's a very merry unbirthday for all of Starbase Indy! Give yourself some good advice and join Kassa for a bit of tea, cocoa, or coffee and a snack. Meet a new friend. Reconnect with old acquaintances. Immerse yourself in nonsense. Score an unbirthday present by answering science and science-fiction based trivia, or just hang out with a group of eclectic folks just like you (or totally different from you.) Can't make it for the full event but want to nosh a tiny bit? That's fine. Come when you can and as you are. Everyone is welcome! ",Mingle,,,27,Kassandra Mariano,,,,,,,,,
4,Let's Play Scythe!,,Observation Lounge (Golden Preconvene),2017-11-24,15:00,180,"Scythe is a board game set in an alternate-history 1920s period. It is a time of farming and war, broken hearts and rusted gears, innovation and valor. In Scythe, each player represents a fallen leader attempting to restore their honor and lead their faction to power in Eastern Europa. Players conquer territory, enlist new recruits, reap resources, gain villagers, build structures, and activate monstrous mechs. We're looking for 3-5 players to join us in a game of Scythe (https://stonemaiergames.com/games/scythe/). We can teach you to play it, but if you're already familiar, all the better! We will be using the ""Invaders From Afar"" expansion.",Gaming,,,10,Chuck Warren,,,,,,,,,
7,Kate's Take Live Podcast of Star Trek 3: The Search for Spock,,Astrophysics (FS-D),2017-11-24,16:00,60,"Kate's Take will once again record live their journey into Star Trek movies with The Search for Spock. Your host Kate Chaplin is joined by her Trekkie husband, Josh as they find the universal messages and lessons in the Star Trek movies. The show will be recorded live (video & audio), have a Q&A and be on iTunes, You Tube and most streaming services. Kate's Take is a 5-time award-winning podcast presented by Gal's Guide to the Galaxy.",Podcast,,,28,Kate Chaplin,,,,,,,,,
8,Evolution in Star Trek: Why are There so Many Humanoid Species?,,Guinan's Place (Brickyard),2017-11-24,16:00,60,"Most aliens we see in Trek are not only carbon- and water-based, but they are humanoid, and many can even breed with humans. This panel introduces real evolutionary concepts from Earth and applies them to testing 3 theories raised in various Trek episodes about why so many aliens may be humanoid.",Presentation,STEM,,39,Mohamed Noor,,,,,,,,,
9,Edible Entomology for Kids,,Holocenter (FS-C),2017-11-24,16:00,60,"Geared toward children, participants will explore the fascinating world of edible entomology, first learning about foods made of or with insects, then having the opportunity to taste several dishes contaning insects.",Presentation,STEM,,48,Sarah Gillard,,,,,,,,,
10,Diversity in Cosplay,,Briefing Room (DR-2),2017-11-24,16:00,60,"Cosplay culture has evolved with the times and diversity should be shown to reflect those changes. I will share my own experiences from my twenty-year history of costuming and cosplay in hopes of showing others tolerance, acceptance, and a way to embrace new experiences.",Cosplay,,,37,Michelle Allen,,,,,,,,,
11,Exotic Aliens of TOS,,tlhIngan rlvSo' (Intl Boardroom),2017-11-24,16:00,60,"Star Trek: The Original Series was known for its exotic aliens. From the Orions to the Tholians, the Metrons to the Vians, tribbles and Trelane, and all the rest, Trek had some of the most unusual and visually stimulating aliens ever seen on television. Join us for a discussion of these aliens, how their appearance and actions affected the show, how they interrelated to humans, and how they had such a lasting influence on Trek and the fans.",Discussion,Klingon,,29,Kathy Peck,,,,,,,,,
14,Scientific Counterarguments for Climate Change Skepticism,,Guinan's Place (Brickyard),2017-11-24,17:00,60,"Increasingly America and other nations have become oblivious to the real effects of Climate Change on everyday life.  Some citizens argue that they are unaffected by our changing environment - so why should they care?

We’ll look at documented scientific trends in climate and weather that have affected everything from consumer prices to health care and infrastructure.  We will explore why it is important to translate climate change into cause and effect and how to effectively communicate the effects to create awareness and change at a local and national level.",Presentation,STEM,,8,Charlie Dewes,,,,,,,,,
15,Weather Center,,Holocenter (FS-C),2017-11-24,17:00,60,"Learn the basics of predicting, monitoring and recording the weather! We will build devices for you to take home to set up your very own Weather Center and you'll be able to predict the weather just like the pros!",Workshop,STEM,,4,Beth Ann Broadhurst,,,,,,,,,
16,Klingon Courtship Ceremony: Prove your love for your significant other,,tlhIngan rlvSo' (Intl Boardroom),2017-11-24,17:00,60,"Klingon dating is a contact sport. Bring that person who is special to you and demonstrate your love for them by reciting epic poems of love. But be careful, they will be armed and dangerous. They will be given large furry objects to hurl your way. Be ready to duck.",Mingle,Klingon,,25,John Lars Shoberg,,,,,,,,,
12,The Humanism of Star Trek,,Astrophysics (FS-D),2017-11-24,17:00,120,"Why do you like Star Trek? Is it the stories? The costumes? The engineering and science of space travel? Or maybe its the promise that in the 23rd and 24th centuries, mankind will have somehow found a way to rise above racism, misogyny, capitalism / poverty / hunger, and our bellicose nature? Join us for rousing discussion/celebration of cultural diversity in Star Trek, and its hope for the future.",Discussion,Humanities,,3,Ann Burton,,,,,,,,,
139,United Federation for Science Mixer,,United Federation for Science (GB-6),2017-11-24,17:00,120,Private mixer for United Federation of Science organizers,Mingle,Private,,59,March for Science,,,,,,,,,
17,Joseph Franklin & Friends: Just Venting!,,Main Bridge (GB1-5),2017-11-24,17:30,30,"Ventriloquist Joseph Franklin brings a variety of characters to life in a show full of comedy, with a geeky twist!",Entertainment,,,26,Joseph Franklin,,,,,,,,,
18,Design Your Own Alien,,Holocenter (FS-C),2017-11-24,18:00,60,What do you see other life forms looking like? What would they have that we don't? How do they survive on their planet? Create your vision of what you think other beings will look like when we make it to their planet in this craft workshop.,Workshop,Crafting,STEM,4,Beth Ann Broadhurst,,,,,,,,,
19,Banana DNA: a closer look,,Guinan's Place (Brickyard),2017-11-24,18:00,60,"Join us as we extract the building blocks of life from a banana. Participants will have the opportunity to extract DNA from a banana, watch it form, and view it under a microscope. Space is extremely limited.",Workshop,STEM,,48,Sarah Gillard,,,,,,,,,
20,Cosplay is Not Consent,,Briefing Room (DR-2),2017-11-24,18:00,60,"Every convention should have guidelines in place already to protect convention attendees from harrassment. This panel will help individuals that cosplay, as well as people that like to view and enjoy it, know how to make things easier and more enjoyable for everyone.",Cosplay,,,37,Michelle Allen,,,,,,,,,
21,Moxie's Variety Hour,,Main Bridge (GB1-5),2017-11-24,18:00,60,"Moxie Anne Magnus breathes new life into the variety show the way Dr. Frankenstein breathed new life into that monster of his. Music, comedy, game show, and more! Come along for an hour of intergalactic awesomeness!",Entertainment,,,40,Moxie Ann Magnus,,,,,,,,,
22,Ain't No Party Like A Klingon Party!,,tlhIngan rlvSo' (Intl Boardroom),2017-11-24,18:00,60,"House parties, potlucks, room parties.... get tips, recipes, & ideas!",Mingle,Klingon,,23,Jen Usellis,,,,,,,,,
24,Opening Ceremonies,,Main Bridge (GB1-5),2017-11-24,19:00,60,Kickoff your Starbase Indy experience with Opening Ceremonies hosted by Moxie Ann Magnus!,Entertainment,,,40,Moxie Ann Magnus,,,,,,,,,
25,Engineering Soft Scifi Spaceships,,Astrophysics (FS-D),2017-11-24,20:00,60,"The engineering process is not just for the nitty-gritty details of hard SF-it's also a great way to develop a setting in a way that meshes with your plot. From requirements development to trade studies and conceptual design, the engineering process can be toned to just the right hardness for a space opera romp while lending texture to setting and plot.",Presentation,STEM,,50,Shannon Eichorn,,,,,,,,,
27,Costume Contest Show,,Main Bridge (GB1-5),2017-11-24,20:00,60,"Hosted by the fabulous Moxie Ann Magnus and judged by Aris of your local cosplay shop Incognito by Aris & Rome, this year’s cosplay event is sure to be extra spectacular. Come watch or participate in the costumed pageantry, win fabulous prizes and stay for dancing and karaoke directly following! ",Cosplay,,,40,Moxie Ann Magnus,73,Aris,,,,,,,
23,Star Trek Attack Wing Tabletop Game,,Observation Lounge (Golden Preconvene),2017-11-24,20:00,120,"Star Trek: Attack Wing is a tactical space combat miniatures game, featuring collectible pre-painted ships from the Star Trek Universe. Utilizing the FlightPath™ maneuver system, command your fleet in space combat & customize your ship with a captain, crew, weapons and tech upgrades. Choose fleets from the Dominion, Federation, Klingon and Romulan factions based on abilities, maneuvers, upgrades and more. Take command of your ship or fleet, defeat your opponent and save the universe...",Gaming,,,56,Blue Moon Comics,,,,,,,,,
26,Quark's VIP Reception,,Intergalactic Mess Hall (FS- A/B),2017-11-24,20:00,120,"If you are staying with us at the Wyndham, you are eligible to attend this special exclusive reception where you can nibble on hors d’oeuvres, meet other attendees, and rub elbows with our guest stars. There will be one hour of free drinks followed by an hour of cash bar.

(Note for non-Earth residents and time travelers: “Rub elbows” is a common figure of speech in the 21st century. Please do not actually attempt to rub the elbows of anyone else at this reception.)
",Mingle,,,,,,,,,,,,,
28,The Science of Sexuality,,Astrophysics (FS-D),2017-11-24,21:00,60,"Sexuality research is still in its infancy and is often contaminated by cultural beliefs about gender, stereotypical sex roles, and so on. This presentation will cover what we actually know to be true about sexual activities, arousal, and orientations, as well as how we know what we know. Be prepared to nerd out with lots of citations!",Presentation,STEM,,22,Dr. Jeana Jorgensen,,,,,,,,,
31,Cosplay Dance/Karaoke,,Guinan's Place (Brickyard),2017-11-24,21:00,180,"Join DJ Spinson Lot, the DJ who won't stop, as they entertain and delight you with karaoke, dance tunes, and general celebration. Take your cosplay for a spin on the dance floor, or just mingle with other attendeesOpen to all ages. ",Cosplay,,,17,DJ Spinsinlot,,,,,,,,,
29,Flies in Amber LARP,,Holocenter (FS-C),2017-11-24,21:00,240,"In a spirit of cooperation, the Federation and the Klingon Empire have come to an agreement to share resources along the Neutral Zone. One of these places is a small class M planet simply known as NZ0002. The planet is rich in dilithium ore. While excavating a rich vein, a Federation mining company found something buried in a rock face. This object of unknown origin was reported to Starfleet. The Federation has dispatched an Oberth Class Science Vessel, The USS Archimedes to investigate. Not to be outdone, the Klingon Empire has also sent out a ""science"" vessel the IKS Vulture, to make sure any information gleamed from this strange object is shared.
 
""Flies in Amber” is a Cthulhu Live! / Star Trek crossover LARP set in the 23rd century. This is the Original Series timeline. Players will take up the roles of Miners, Members of the crew of The Archimedes, and loyal servants of the Klingon Empire. There are several alien races to choose from and costumes are encouraged. Characters are pre-assigned but there may be some spaces left. See the Starbase Indy booth in the vendor room for more information. 
",LARP,,,61,PST Productions,,,,,,,,,
30,Movie: Smithsonian's Building Star Trek,,Main Bridge (GB1-5),2017-11-24,21:30,120,"When ""Star Trek"" first aired in 1966, it expanded the viewers' imaginations about what was possible in their lifetimes. Today, many of the space-age technologies displayed on the show, like space shuttles, cell phones, and desktop computers, have already gone from science fiction to science fact. Other innovations, like warp drive, teleportation, and medical tricorders are actively in development. Join us as we celebrate the 50th Anniversary of ""Star Trek"" - a show that continues to inform, enrich, and inspire.",Presentation,STEM,,,,,,,,,,,,
32,Are You A Werewolf and Other Games!,,Observation Lounge (Golden Preconvene),2017-11-24,22:00,180,"Local gaming hotspot Game Paradise hosts four hours of social gaming. Come play ""Secret Hitler,"" ""Are You a Werewolf?"" and many others. Don't know how to play? No problem! Game Paradise's volunteer is happy to teach you.",Gaming,,,60,Game Paradise,,,,,,,,,
34,From Aesop to Asimov: Sci-Fi as the Modern Fable,,Guinan's Place (Brickyard),2017-11-25,10:00,60,"For millennia, whether spinning them before the communal fire or beaming them directly into a VR headset, storytellers have used myth to enlighten, to encourage and to educate. Today, the minds behind science fiction have taken up the mantle of the myth makers, finding creativie and nuanced ways to tackle the questions of ethics, pushing the limits of imaginations to communicate ideas of immediate importance.",Presentation,Humanities,,38,Mike Hargett,,,,,,,,,
114,KAG General Assembly,,tlhIngan rlvSo' (Intl Boardroom),2017-11-25,10:00,60,,Presentation,Klingon,,,,,,,,,,,,
33,Philosophical Themes of Science-Fiction,,Astrophysics (FS-D),2017-11-25,10:00,120,"This panel will focus on the various philosophical themes that arise in various sci-fi media, including Star Trek, Star Wars, Battlestar Galactica, the films of Christopher Nolan, etc. The panelists have edited or contributed to several books exploring such themes and will facilitate an open-forum discussion with the audience on any topic in this area that may interest them, from artificial intelligence, to ethical dilemmas, to the very nature of reality. Come prepared with musings or questions you've been pondering about your favorite sci-fi films and TV shows!",Discussion,Humanities,,21,Jason Eberl,55,Walter Robinson,,,,,,,
35,Star Trek Attack Wing Tabletop Demo,,Observation Lounge (Golden Preconvene),2017-11-25,10:00,120,"Star Trek: Attack Wing is a tactical space combat miniatures game, featuring collectible pre-painted ships from the Star Trek Universe. Utilizing the FlightPath™ maneuver system, command your fleet in space combat & customize your ship with a captain, crew, weapons and tech upgrades. Choose fleets from the Dominion, Federation, Klingon and Romulan factions based on abilities, maneuvers, upgrades and more. Take command of your ship or fleet, defeat your opponent and save the universe...",Gaming,,,56,Blue Moon Comics,,,,,,,,,
36,StarFleet Command Meeting,,Main Bridge (GB1-5),2017-11-25,10:00,120,"Participate in one of the oldest Star Trek fan clubs in existence (formed in 1974) as they celebrate the past year's success in fandom. You can meet members of local ships and hear about their activites that include fundraisers, science and science fiction based outings, and charity events of all kinds. The annual meeting includes reports from all departments, presentation of awards for outstanding achievement, and usually, a drawing or two. If you wish, you can stick around after the meeting to chat with the Admiralty Board and other Starfleet Command members.",,,,62,StarFleet Command,,,,,,,,,
37,Personal Genetic Testing: Health & Ancestry,,Guinan's Place (Brickyard),2017-11-25,11:00,60,"Personal genetic testing is more available than ever, thanks to companies like 23andMe. But what are the limits of what that testing can tell you? Find out!",Presentation,STEM,,39,Mohamed Noor,,,,,,,,,
38,Cookie Mining,,Holocenter (FS-C),2017-11-25,11:00,60,"The mining of our country’s natural resources is not just a simple matter of finding the desired ore and digging it up. Important economic and environmental considerations are involved in any mining venture. These include property costs, mining equipment costs, operational costs, and land reclamation costs. Fines for violations of environmental regulations may also be incurred. If a mining corporation is to make a profit, the value of the recovered ore must be greater than the sum of all of its mining costs plus any environmental fines. In this lab you will create a mining corporation and attempt to run a cookie mining operation that is both profitable and environmentally sound.",Workshop,STEM,,48,Sarah Gillard,,,,,,,,,
39,The Moxie Magnus Choose Your Own Adventure RPG! ,,Briefing Room (DR-2),2017-11-25,11:00,60,"You have been chosen for a quest! Strap yourself in folks as the room becomes a magical transport through time and space, taking us all on a quest to save the very existence of mankind! Moxie will guide you as you choose your path through dangers to gain amazing treasures! This is not your grandpappy’s dungeon crawl!",Gaming,,,40,Moxie Ann Magnus,,,,,,,,,
40,Klingon Linguistics,,tlhIngan rlvSo' (Intl Boardroom),2017-11-25,11:00,120,"Join the inventor of the Klingon language and an actor who had to speak it on stage for a conversation about the language, how it came to be, and how it affected the actors who incorporated it into their work.",Presentation,Klingon,STEM,34,Marc Okrand,44,Robert O'Reilly,,,,,,,
111,The KAG Podcast: What the baQa' are we trying to do?,,tlhIngan rlvSo' (Intl Boardroom),2017-11-25,11:00,420,"General discussion of the KAG podcast. What we have done, what we plan to do and what do you want us to talk about?",Podcast,Klingon,,25,John Lars Shoberg,25,,,,,,,,
115,United Federation of Science Round Table,,United Federation for Science (GB-6),2017-11-25,11:00,,MFS Indy will facilitate a private round table discussion amongst the Midwest MFS leadership teams in attendance. This roundtable will be designed to help strengthen the nascent Midwest MFS network and encourage collaboration between the cities.,Private,,,46,Rufus Cochran,,,,,,,,,
41,Women of Science Game,,Astrophysics (FS-D),2017-11-25,12:00,60,"Participate in this fun game for all ages of women of science history. Presented by Gal's Guide to the Galaxy, these time travelers of history will present 26 women from various sciences and see how many you knew and what new gals you might never have heard about in school.",Gaming,,,28,Kate Chaplin,,,,,,,,,
42,Cassini and Saturn,,Guinan's Place (Brickyard),2017-11-25,12:00,60,The latest discoveries from NASA's Cassini mission to Saturn.,Presentation,STEM,,19,Heather Drinkwater,,,,,,,,,
43,Genius Kits,,Holocenter (FS-C),2017-11-25,12:00,60,You are stranded on a remote planet and were only able to salvage what is in the Kit you have been given. Do you build a spaceship? Communications device? Signaling devices to find help? Or something to make life on your new home better?,Workshop,STEM,,4,Beth Ann Broadhurst,,,,,,,,,
44,Rocket Types & How They Work,,Briefing Room (DR-2),2017-11-25,12:00,60,"It’s rocket science! But what type? Chemical rockets are standard, but there are other types of space propulsion, too: nuclear thermal, ion, solar sails, and more!",Presentation,STEM,,50,Shannon Eichorn,,,,,,,,,
45,John Billingsley and Bonita Friedericy Q&A,,Main Bridge (GB1-5),2017-11-25,12:00,60,,Q&A,Media Guests,,16,John Billingsley,75,Bonita Friederacy,,,,,,,
62,Teddy Bear Tea Party,,Observation Lounge (Golden Preconvene),2017-11-25,12:30,60,"Teddy Bear Tea is an opportunity for the young and the mature to show off their favorite Trek or other sci-fi themed 'stuffed' friends with others. Meet other collectors, glimpse other creations, make a new friend or two, play a game, maybe win a prize and just social. Admission is free to all con attendees and their 'stuffed' friends. Refreshments are provided, Hosts for 2017 include Starfleet Command members: Rose Ciccarone, and crew of USS Indianapolis NCC 1945-D.",Mingle,,,45,Rose Ciccarone,,,,,,,,,
116,John and Bonnie Photo Op,,Promenade,2017-11-25,13:00,30,Get your photo taken with John Billingsley and Bonita Friedericy. Additional fee required.,Photo Op,Media Guests,,16,John Billingsley,75,Bonita Friedericy,,,,,,,
46,So You Wanna Go Solar,,Astrophysics (FS-D),2017-11-25,13:00,60,"If you are interested in solar energy works, battery systems, and how many solar modules would take to run your home; come see Phil Teague, Co-Founder of Rectify Solar give a presentation on the ins and outs of solar energy!",Presentation,STEM,,41,Phil Teague,,,,,,,,,
47,Holodeck 2017,,Guinan's Place (Brickyard),2017-11-25,13:00,60,"The state of the art in virtual reality (VR) systems today is unique. We live in a time where VR systems and content have recently proven profitable as a consumer electronic device. Many of the ""hard problems"" have been solved and VR systems are on track to annually improve. In the past 30+ years of VR work, progress has been much slower. The holodeck from Star Trek represents the ultimate VR system. Users in the holodeck are are portrayed to experience seamless virtual environments where the simulation was ""real."" Currently available VR systems allow users to experience virtual environments with several limitations including the inability feel/touch, eat, or even smell items in the virtual world. Some recent work has been completed at Indiana University to provided VR system developers with a tool to help extend VR computers for electronic control of physical devices. This tool is named cy.PIPES. What this new innovation allows for is the easy construction of environmental feedback within a VR system. Developers need only to connect common house fans arranged around a VR space to simulate wind conditions. Similarly this could be done with heat lamps for heat feedback. Supporting olfactory (smell) feedback is also possible with common pieces and parts found at a hardware store. This presentation will explain how close we are to having a real working holodeck here in the year 2017. A cy.PIPES VR system will be setup for demonstration.",Presentation,STEM,,9,Chauncey Frend,,,,,,,,,
48,Solution Squad: Putting the M in STEM,Cancelled,Holocenter (FS-C),2017-11-25,13:00,60,"STEM education is on the rise, and on the cutting edge of STEM comics comes Solution Squad, a team featuring math-themed superheroes. Now there's a full-size graphic novel with lessons and activities for grades 4-8! Join creator and Indiana middle school teacher Jim McClain as he shows you (with a free download code) how Solution Squad helps students better understand an abstract subject through comics! Solution Squad comics are available in print, in special landscape digital format perfect for classroom projection, and there's even a YouTube channel with Solution Squad character puppets!",Presentation,STEM,,24,Jim McClain,,,,,,,,,
49,What is Secular Humanism?,,Briefing Room (DR-2),2017-11-25,13:00,60,"Gene Roddenberry's Secular Humanism influenced his writing on Star Trek. Reba Wooden, Executive Director of Center For Inquiry Indiana, will talk about what Secular Humanism is. Center For Inquiry is a Secular Humanist organization that seeks to foster a secular society based on reason, science, freedom of inquiry, and humanist values. http://www.centerforinquiry.net/indy",Presentation,Humanities,,43,Reba Boyd Wooden,,,,,,,,,
