id,title,status,loc.0,date,time,mins,desc,tags.0,tags.1,tags.2,people.0.id,people.0.name,people.1.id,people.1.name,people.2.id,people.2.name,people.3.id,people.3.name,people.4.id,people.4.name,140
135,Student Sunday: Children's Costume Parade,,Guinan's Place (Brickyard),2017-11-26,14:00,30,Let’s close SBI’s first Student Sunday science carnival with a joyful costume parade and photo op! Gather up your geeklings and meet at Guinan’s Place. Dress as your favorite scientist or science fiction character and you will have the opportunity to show off your fancy duds as we parade with music and merriment around the con and up onto the main stage/bridge set for a group picture to commemorate the day’s fun! Prizes for the younglings who participate provided by your friendly Indianapolis cosplay store Incognito by Aris & Rome.  ,Cosplay,Student Sunday,,73,Aris,,,,,,,,,
107,Homesteading a New Planet,,Astrophysics (FS-D),2017-11-26,14:00,60,"Attendees will actively participate in the planning stages of homesteading a newly discovered planet that is able to sustain the flora and fauna of life as we know it. Space and weight are limited for our planetary pioneers, and every candidate and pound of cargo must be taken into consideration as the flagship homesteaders prepare for their journey. Participants will each have the opportunity to decide who and what to take, and will then find out if their team was able to successfully homestead our new planet.",Workshop,STEM,,48,Sarah Gillard,,,,,,,,,
108,Tribbles for Pets,,Observation Lounge (Golden Preconvene),2017-11-26,14:00,60,Love Tribbles? Have a cat or dog? Why not share your love of tribbles with your pet by creating a tribble with catnip inside or a squeaky tribble for your dog? Panel would supply materials for guests to create either a catnip filled tribble for a cat or a squeaky toy filled tribble for a dog.,Crafting,,,15,Deborah Harland,,,,,,,,,
110,Complete your Klingon With Props & Accessories,New Time!,tlhIngan rlvSo' (Intl Boardroom),2017-11-25,16:00,60,"Do you want your costume to stand out from the rest? There is honor in Accessorizing! come join us for a run down on prop and accessory making, how to decide what to add and what to avoid. Learn from our mistakes and our successes.",Cosplay,Klingon,,12,Daniel McNamara,,,,,,,,,
109,Light Saber Battles,,Main Bridge (GB1-5),2017-11-26,14:15,45,"The culimnation of Sunday's Light Saber Training, come watch the finalists battle each other for the glory of the Force.",Workshop,Lightsaber,,58,Indiana Light Saber Academy,,,,,,,,,
138,Con Feedback Hour,,Astrophysics (FS-D),2017-11-26,15:15,45,Come share your thoughts about the convention and find out how you can be more involved next year.,,,,,,,,,,,,,,