id,name.0,name.1,name.2,name.3,prog.0,prog.1,prog.2,prog.3,prog.4,prog.5,prog.6,prog.7,prog.8,links.img,bio,76
43,Reba Boyd,Wooden,,,49,,,,,,,,,,"Reba Boyd Wooden is Executive Director of Center for Inquiry Indiana. She sarted Humanist Friendship Group of Central Indiana in 1999 which became Center for Inquiry Community of Indiana in 2005 and in 2007 Center for Inquiry Indiana opened on the Idiananpolois downtown canal walk. With degrees in business, education, history and counseling, she has spent he last 13 years as a high school guidance counselor. In 205 Reba retired after 37 years in Public Education.",
44,Robert,O'Reilly,,,40,100,118,119,124,125,,,,,"Robert O'Reilly's appearances on the last season of Star Trek: Deep Space Nine marked a decade of work on Star Trek. O'Reilly's introduction to Star Trek: The Next Generation was in the episode entitled ""Manhunt"" in which he portrayed the gangster ""Scarface."" He then successfully auditioned for the part of the Machiavellian Klingon leader, Gowron, for the episode, ""Reunion.""
Besides the many appearances on Star Trek: The Next Generation and Star Trek: Deep Space Nine as Gowron, Robert has participated in many Star Trek related extra-curricular activities including a Decipher VCR Interactive Board game, lithographs sold nationwide on QVC, a sci-fi Fantasy model, three action figures, life-sized, stand-up Gowron poster, and most recently, starring in the CD-ROM ""Star Trek: Klingon"" for which Robert won the Sci-Fi Universe Reader's Choice Universe Award for Best Achievement in Genre Multi-Media. In this game not only will Robert teach you how to be a Klingon, he also will teach you how to speak like one.
Robert's stage work has spanned a broad spectrum from Shakespeare (""King Lear"" and ""Hamlet"") and Sam Shepard (""True West"") to original plays (""When The Bough Breaks"") and the original production of ""The Grapes of Wrath."" He is proud to have starred in the original productions of ""The Martian Chronicles"" and ""Fahrenheit 451"" (plays written by and based on the books by Ray Bradbury, who has since become a friend).
Robert directed his play in 1981—Marsha Norman's ""Getting Out—and was promptly nominated by the Los Angeles Drama Circle for Best Director of the Year, the most prestigious award given to a Los Angeles theater director. Since then he has won or been nominated for every other major directing award the Los Angeles area has to offer. His original production of ""Generations"" by Dennis Clontz received National Honors as a runner-up to August Wilson's ""Piano Lesson"" for the best play produced outside of New York City.
In spite of his busy schedule, Robert continues, each year, to direct one play and act in at least one theater production. He is a member and Artistic Advisor at the Colony Studio Theater Playhouse, a repertory company in Los Angeles that boasts a 90% subscription rate. Recently, he directed the ""Mornings At Seven,"" and acted in ""Fool For Love"" by Sam Shepard.
Robert has appeared in over 100 films, made-for-TV movies, and television episodes. His most recent projects include the soon-to-be released films ""Moonbase,"" in which he stars as the evil convict Stark, and ""Good Luck,"" starring Gregory Hines. He has also appeared in the ""The Mask"" starring Jim Carrey, as well as ten other feature films. Mini-series and movie-of-the-week appearances include ""Desperado: Badlands Justice,"" ""World War III,"" ""From Here To Eternity"" and ""By The Dawn's Early Light."" Television series include NYPD Blue and two seasons on In the Heat of the Night and Dark Justice. Other episodic television credits include such series as Murder, She Wrote (2 appearances), Dallas (2 appearances), Hunter, Falcon Crest, The Flash, Hill Street Blues, Max Headroom, The Equalizer, Sledgehammer, Paradise, Jake and the Fatman, MacGyver, and many more. Robert generally portrays villains or antagonists and is particularly expert in the use of a variety of dialects and accents.
Robert resides with his wife in Los Angeles. During his infrequent times of rest and recreation, you may find him playing a round of golf, attending an enjoyable game of baseball, or watching a good film or television show, particularly if it's set in the Star Trek universe.
Robert's wife gave birth on January 1, 1997 at 12:01a.m., 12:03a.m., and 12:04a.m. to Jack, Joseph, and Michael—their three sons.
",
45,Rose,Ciccarone,,,62,,,,,,,,,,,
46,Rufus,Cochran,,,58,66,74,98,115,,,,,,"Creator of the combat robotics team ""denkbots"" and founder of the Indiana Science Communication and Education Foundation, Rufus Cochran is a computer engineer and native Hoosier with a passion for science and technology. Working in mechatronics and automated systems across industries throughout his professional career, Rufus works to share his love of robotics and technology with everyone he meets! He has mentored in the FIRST (For Inspiration and Recognition of Science and Technology) Robotics Competition and other STEM programs for high school students for over a decade, with the hopes of inspiring the next generation to use these technologies to help solve our societies greatest challenges.",
73,Aris,,,,135,,,,,,,,,,"Aris Incognito by Aris & Rome produces custom costumes and props for all occasions and incidents. From replicas and reproductions to one of a kind designs, we work to obscure identities and realize new ones in a variety of mediums. 1-317-492-9724 1060 Virginia Ave. Indianapolis, IN 46203 Incognitobyarisandrome.com",
48,Sarah,Gillard,,,9,19,38,53,107,,,,,,"Sarah Gillard comes to us from Ancilla College, where she teaches the Sciences. Sarah currently teaches Anatomy and Physiology, and has also recently taught Microbiology and Animal Science courses as well. Gillard holds multiple degrees in Science, Education and Agriculture from Purdue University, and is currently working towards a PhD in the Philosophy of Education. While at Purdue University, Gillard taught Educational Psychology and Art Appreciation. Gillard is also a published author, with manuscripts in several educational journals and monthly publications. When not teaching or researching, Gillard enjoys a quiet life with her husband and daughter on their homestead, surrounded by their animals.",
74,Savannah,O'Connor,,,,,,,,,,,,,"Savannah O’Connor is a stage performer and musician with local pop-culture pop band The Shake Ups. She is also passionate about learning and a lover of all things Trek. She believes wholeheartedly in Starbase Indy: The Next Generation’s inspiring new vision. To love Star Trek is to hope in the future. What better way to celebrate Star Trek then by trying to shape our real future in that beautiful image by promoting science education and humanitarianism? Plus, she thinks all of these new panels about the science and vision of Star Trek are super rad and fun! Come catch her infections energy as she frolicsomely facilitates activities on the main stage and the children’s Student Sunday Science Carnival this weekend.",
50,Shannon,Eichorn,,,25,68,44,52,,,,,,,"Shannon Eichorn got her BSE in Aerospace and Mechanical Engineering (from Case Western Reserve University) because her dad told her she needed a day job to write scifi novels. She decided to be Sam Carter (who really was an engineer, obviously) and found a place in the world of wind tunnel (and other aerospace) testing. Her first novel is under contract with a small publisher.",
51,Skip,Engle,,,78,,,,,,,,,,"Skip started brewing over 20 years ago when he joined the SCA. This medieval re-enactment group began his adventures in brewing with the popular Viking beverage mead. Skip quickly transitioned to beers and later ciders, choosing styles and flavors that reflected what he and his friends loved to drink. Since then he has explored dozens of different styles and brewed hundreds of different beers and ciders. He spent many years as the brewmaster for Barfleet’s UBS Casual in Cleveland brewing beer for dozens of parties and conventions. His cider has often been available at Indecent parties as it is a favorite of Captain Lucy and many others. By day Skip is an apprentice Electrician at Ford Motor Company where he has worked for 25 years.",
62,StarFleet Command,,,,36,,,,,,,,,,,
52,Thomas,Wysocki,,,75,,,,,,,,,,,
53,Tony,Troxell,,,63,,,,,,,,,,"Tony Troxell is the local blogger and podcaster in charge of ""Geeking in Indiana"", a blog that showcases items he feels would be of interest to Hoosier Geeks. This has gained him a certain measure of fame over the last few years, having been interviewed by the Indy Star for various articles about Hoosier Geeks, garnering a ""Top Three"" placing in Nuvo's Best of Indy competition in the ""Best local Twitter feed"" category for the past three years, and being asked to sit in on panels at local conventions, like this one! He grew up with Star Wars (born two days before the premier of the first film), but really embraced his inner Geek during the Star Trek 25th Anniversary in 1991, and since that time has worked in various Geeky fields like video game stores, comic book shops, Hollywood practical fx, and driving a submarine looking for Nemo at Disneyland. He is incredibly honored and excited to help out with this year's show, talking the first half of Star Trek Discovery!",
54,Troy,Maynard,,,85,,,,,,,,,,"Troy Maynard is a giant Viking, foodie, geeky gamer, father of three and master of none. Between frequent photographs of meals and occasional pillaging (alleged), he writes his thoughts on life from his Mead Hall in the rolling hills of southern Indiana. Ransacking passing ships doesn't pay the bills, so he also works in the software industry, where he gets to use his tantrum management skills on a daily basis.You can read more of his stories and thoughts on parenting on his blog, veryvocalviking.com, and in his column My Dad Voice in Limestone Post Magazine, limestonepostmagazine.com/author/troymaynard.",
67,UBS Indycent,,,,128,,,,,,,,,,,
71,Una,Hartzell-Baird,,,136,,,,,,,,,,"Una Hartzell-Baird is a Starbase n00b and excited to finally be putting her STEM Pinterest boards to good use. She's lived in Indy for 20+ years, most recently with her husband, son, and remaining cat. When she's not saving the world at her day job, her interests include reading, napping, Girl Scouts, and taking walks with her family. What qualifies her to bring science activities to your kids? She's a sucker for volunteer opportunities and passionate about sparking future scientists' imaginations. Plus, that STEM Pinterest board is really extensive.",
55,Walter,Robinson,,,33,,,,,,,,,,Dr. Walter Robinson is an adjunct faculty member of the philosophy department at IUPUI where he teaches Buddhist Philosophy. He works in hospice care and is a member of both the Indianapolis Zen Center (IZC) and the Tibetan Cultural Center (TCC).,
75,Bonnie,Freideracy,,,45,96,120,121,116,117,,,,,,